{"bindings":{},"capabilities":{"layout":"nested_array"},"hashes":{"bindings":"44136fa355b3678a1146ad16f7e8649e94fb4fc21fe77e8310c060f61caaff8a","inputs":"4f53cda18c2baa0c0354bb5f9a3ecbe5ed12ab4d8e11ba873c2f11161202b945","ops_by_decl":"3840bc7b3603832a0dbefdb144a1187abc21825ea9604af5c2d9d3378966bf43","plan":"e14c8ad0e630083cda0cf51367325ae31eef85390daeafd81c2b847f70fd8aba"},"inputs":[],"module_id":"schema_module","ops_by_decl":{"employee_bonus":{"operations":[{"args":["high_performer"],"attrs":{},"id":0,"op":"LoadDeclaration"},{"args":["senior_level"],"attrs":{},"id":1,"op":"LoadDeclaration"},{"args":["top_team"],"attrs":{},"id":2,"op":"LoadDeclaration"},{"args":[1,2],"attrs":{"fn":"core.and"},"id":3,"op":"Map"},{"args":[0,3],"attrs":{"fn":"core.and"},"id":4,"op":"Map"},{"args":[["regions","offices","teams","employees","salary"]],"attrs":{},"id":5,"op":"LoadInput"},{"args":[0.3],"attrs":{},"id":6,"op":"Const"},{"args":[5,6],"attrs":{"fn":"core.mul"},"id":7,"op":"Map"},{"args":[0,2],"attrs":{"fn":"core.and"},"id":10,"op":"Map"},{"args":[0.2],"attrs":{},"id":11,"op":"Const"},{"args":[5,11],"attrs":{"fn":"core.mul"},"id":12,"op":"Map"},{"args":[0.05],"attrs":{},"id":13,"op":"Const"},{"args":[5,13],"attrs":{"fn":"core.mul"},"id":14,"op":"Map"},{"args":[10,12,14],"attrs":{},"id":15,"op":"Select"},{"args":[4,7,15],"attrs":{},"id":16,"op":"Select"}],"result":16},"high_performer":{"operations":[{"args":[["regions","offices","teams","employees","rating"]],"attrs":{},"id":0,"op":"LoadInput"},{"args":[4.5],"attrs":{},"id":1,"op":"Const"},{"args":[0,1],"attrs":{"fn":"core.gte"},"id":2,"op":"Map"}],"result":2},"senior_level":{"operations":[{"args":[["regions","offices","teams","employees","level"]],"attrs":{},"id":0,"op":"LoadInput"},{"args":["senior"],"attrs":{},"id":1,"op":"Const"},{"args":[0,1],"attrs":{"fn":"core.eq"},"id":2,"op":"Map"}],"result":2},"top_team":{"operations":[{"args":[["regions","offices","teams","performance_score"]],"attrs":{},"id":0,"op":"LoadInput"},{"args":[0.9],"attrs":{},"id":1,"op":"Const"},{"args":[0,1],"attrs":{"fn":"core.gte"},"id":2,"op":"Map"}],"result":2}},"pack_version":"0.1","plan":{"declarations":{"employee_bonus":{"axes":["regions","offices","teams","employees"],"axis_carriers":[{"axis":"regions","via_path":["regions"]},{"axis":"offices","via_path":["regions","offices"]},{"axis":"teams","via_path":["regions","offices","teams"]},{"axis":"employees","via_path":["regions","offices","teams","employees"]}],"inlining_decisions":{"op_0":{"decision":"inline","producer":"high_performer","use_site_axes":["regions","offices","teams","employees"]},"op_1":{"decision":"inline","producer":"senior_level","use_site_axes":["regions","offices","teams","employees"]},"op_2":{"decision":"inline","producer":"top_team","use_site_axes":["regions","offices","teams"]}},"name":"employee_bonus","parameters":[{"kind":"input","path":["regions","offices","teams","employees","salary"]},{"kind":"dependency","source":"high_performer"},{"kind":"dependency","source":"senior_level"},{"kind":"dependency","source":"top_team"}],"reduce_plans":[],"result_id":16,"site_schedule":{"by_depth":[{"depth":0,"ops":[{"id":6,"kind":"const"},{"id":11,"kind":"const"},{"id":13,"kind":"const"}]},{"depth":1,"ops":[]},{"depth":2,"ops":[]},{"depth":3,"ops":[{"id":2,"kind":"loaddeclaration"}]},{"depth":4,"ops":[{"id":0,"kind":"loaddeclaration"},{"id":1,"kind":"loaddeclaration"},{"id":3,"kind":"map"},{"id":4,"kind":"map"},{"id":5,"kind":"loadinput"},{"id":7,"kind":"map"},{"id":10,"kind":"map"},{"id":12,"kind":"map"},{"id":14,"kind":"map"},{"id":15,"kind":"select"},{"id":16,"kind":"select"}]}],"hoisted_scalars":[{"id":6,"kind":"const"},{"id":11,"kind":"const"},{"id":13,"kind":"const"}],"max_depth":4,"root_reduces":[]}},"high_performer":{"axes":["regions","offices","teams","employees"],"axis_carriers":[{"axis":"regions","via_path":["regions"]},{"axis":"offices","via_path":["regions","offices"]},{"axis":"teams","via_path":["regions","offices","teams"]},{"axis":"employees","via_path":["regions","offices","teams","employees"]}],"inlining_decisions":{},"name":"high_performer","parameters":[{"kind":"input","path":["regions","offices","teams","employees","rating"]}],"reduce_plans":[],"result_id":2,"site_schedule":{"by_depth":[{"depth":0,"ops":[{"id":1,"kind":"const"}]},{"depth":1,"ops":[]},{"depth":2,"ops":[]},{"depth":3,"ops":[]},{"depth":4,"ops":[{"id":0,"kind":"loadinput"},{"id":2,"kind":"map"}]}],"hoisted_scalars":[{"id":1,"kind":"const"}],"max_depth":4,"root_reduces":[]}},"senior_level":{"axes":["regions","offices","teams","employees"],"axis_carriers":[{"axis":"regions","via_path":["regions"]},{"axis":"offices","via_path":["regions","offices"]},{"axis":"teams","via_path":["regions","offices","teams"]},{"axis":"employees","via_path":["regions","offices","teams","employees"]}],"inlining_decisions":{},"name":"senior_level","parameters":[{"kind":"input","path":["regions","offices","teams","employees","level"]}],"reduce_plans":[],"result_id":2,"site_schedule":{"by_depth":[{"depth":0,"ops":[{"id":1,"kind":"const"}]},{"depth":1,"ops":[]},{"depth":2,"ops":[]},{"depth":3,"ops":[]},{"depth":4,"ops":[{"id":0,"kind":"loadinput"},{"id":2,"kind":"map"}]}],"hoisted_scalars":[{"id":1,"kind":"const"}],"max_depth":4,"root_reduces":[]}},"top_team":{"axes":["regions","offices","teams"],"axis_carriers":[{"axis":"regions","via_path":["regions"]},{"axis":"offices","via_path":["regions","offices"]},{"axis":"teams","via_path":["regions","offices","teams"]}],"inlining_decisions":{},"name":"top_team","parameters":[{"kind":"input","path":["regions","offices","teams","performance_score"]}],"reduce_plans":[],"result_id":2,"site_schedule":{"by_depth":[{"depth":0,"ops":[{"id":1,"kind":"const"}]},{"depth":1,"ops":[]},{"depth":2,"ops":[]},{"depth":3,"ops":[{"id":0,"kind":"loadinput"},{"id":2,"kind":"map"}]}],"hoisted_scalars":[{"id":1,"kind":"const"}],"max_depth":3,"root_reduces":[]}}},"module_spec":{"declarations":["high_performer","senior_level","top_team","employee_bonus"],"inputs":[{"accessor_name":"at_regions","axes":["regions"],"consumes_axes":["regions"],"dtype":"array","path":["regions"]},{"accessor_name":"at_regions_offices","axes":["regions","offices"],"consumes_axes":["regions","offices"],"dtype":"array","path":["regions","offices"]},{"accessor_name":"at_regions_offices_teams","axes":["regions","offices","teams"],"consumes_axes":["regions","offices","teams"],"dtype":"array","path":["regions","offices","teams"]},{"accessor_name":"at_regions_offices_teams_performance_score","axes":["regions","offices","teams"],"consumes_axes":["regions","offices","teams"],"dtype":"float","path":["regions","offices","teams","performance_score"]},{"accessor_name":"at_regions_offices_teams_employees","axes":["regions","offices","teams","employees"],"consumes_axes":["regions","offices","teams","employees"],"dtype":"array","path":["regions","offices","teams","employees"]},{"accessor_name":"at_regions_offices_teams_employees_salary","axes":["regions","offices","teams","employees"],"consumes_axes":["regions","offices","teams","employees"],"dtype":"float","path":["regions","offices","teams","employees","salary"]},{"accessor_name":"at_regions_offices_teams_employees_rating","axes":["regions","offices","teams","employees"],"consumes_axes":["regions","offices","teams","employees"],"dtype":"float","path":["regions","offices","teams","employees","rating"]},{"accessor_name":"at_regions_offices_teams_employees_level","axes":["regions","offices","teams","employees"],"consumes_axes":["regions","offices","teams","employees"],"dtype":"string","path":["regions","offices","teams","employees","level"]}],"modname":"schema_module","version":"0.1"},"version":"0.1"}}