{"bindings":{},"capabilities":{"layout":"nested_array"},"hashes":{"bindings":"44136fa355b3678a1146ad16f7e8649e94fb4fc21fe77e8310c060f61caaff8a","inputs":"4f53cda18c2baa0c0354bb5f9a3ecbe5ed12ab4d8e11ba873c2f11161202b945","ops_by_decl":"1f85cbfe50c5b18a2c2a219aafd1aca585daa13b61e68d82ec9259239eda13ca","plan":"f2ca2a18655715dd817151258f79ee9266825879fe7124a6378c8ad336c951a9"},"inputs":[],"module_id":"schema_module","ops_by_decl":{"status":{"operations":[{"args":["y_positive"],"attrs":{},"id":0,"op":"LoadDeclaration"},{"args":["x_positive"],"attrs":{},"id":1,"op":"LoadDeclaration"},{"args":[0,1],"attrs":{"fn":"core.and"},"id":2,"op":"Map"},{"args":["both positive"],"attrs":{},"id":3,"op":"Const"},{"args":["x positive"],"attrs":{},"id":5,"op":"Const"},{"args":["y positive"],"attrs":{},"id":7,"op":"Const"},{"args":["neither positive"],"attrs":{},"id":8,"op":"Const"},{"args":[0,7,8],"attrs":{},"id":9,"op":"Select"},{"args":[1,5,9],"attrs":{},"id":10,"op":"Select"},{"args":[2,3,10],"attrs":{},"id":11,"op":"Select"}],"result":11},"x_positive":{"operations":[{"args":[["x"]],"attrs":{},"id":0,"op":"LoadInput"},{"args":[0],"attrs":{},"id":1,"op":"Const"},{"args":[0,1],"attrs":{"fn":"core.gt"},"id":2,"op":"Map"}],"result":2},"y_positive":{"operations":[{"args":[["y"]],"attrs":{},"id":0,"op":"LoadInput"},{"args":[0],"attrs":{},"id":1,"op":"Const"},{"args":[0,1],"attrs":{"fn":"core.gt"},"id":2,"op":"Map"}],"result":2}},"pack_version":"0.1","plan":{"declarations":{"status":{"axes":[],"axis_carriers":[],"inlining_decisions":{"op_0":{"decision":"inline","producer":"y_positive","use_site_axes":[]},"op_1":{"decision":"inline","producer":"x_positive","use_site_axes":[]}},"name":"status","parameters":[{"kind":"dependency","source":"y_positive"},{"kind":"dependency","source":"x_positive"}],"reduce_plans":[],"result_id":11,"site_schedule":{"by_depth":[{"depth":0,"ops":[{"id":0,"kind":"loaddeclaration"},{"id":1,"kind":"loaddeclaration"},{"id":2,"kind":"map"},{"id":3,"kind":"const"},{"id":5,"kind":"const"},{"id":7,"kind":"const"},{"id":8,"kind":"const"},{"id":9,"kind":"select"},{"id":10,"kind":"select"},{"id":11,"kind":"select"}]}],"hoisted_scalars":[{"id":0,"kind":"loaddeclaration"},{"id":1,"kind":"loaddeclaration"},{"id":2,"kind":"map"},{"id":3,"kind":"const"},{"id":5,"kind":"const"},{"id":7,"kind":"const"},{"id":8,"kind":"const"},{"id":9,"kind":"select"},{"id":10,"kind":"select"},{"id":11,"kind":"select"}],"max_depth":0,"root_reduces":[]}},"x_positive":{"axes":[],"axis_carriers":[],"inlining_decisions":{},"name":"x_positive","parameters":[{"kind":"input","path":["x"]}],"reduce_plans":[],"result_id":2,"site_schedule":{"by_depth":[{"depth":0,"ops":[{"id":0,"kind":"loadinput"},{"id":1,"kind":"const"},{"id":2,"kind":"map"}]}],"hoisted_scalars":[{"id":0,"kind":"loadinput"},{"id":1,"kind":"const"},{"id":2,"kind":"map"}],"max_depth":0,"root_reduces":[]}},"y_positive":{"axes":[],"axis_carriers":[],"inlining_decisions":{},"name":"y_positive","parameters":[{"kind":"input","path":["y"]}],"reduce_plans":[],"result_id":2,"site_schedule":{"by_depth":[{"depth":0,"ops":[{"id":0,"kind":"loadinput"},{"id":1,"kind":"const"},{"id":2,"kind":"map"}]}],"hoisted_scalars":[{"id":0,"kind":"loadinput"},{"id":1,"kind":"const"},{"id":2,"kind":"map"}],"max_depth":0,"root_reduces":[]}}},"module_spec":{"declarations":["y_positive","x_positive","status"],"inputs":[{"accessor_name":"at_x","axes":[],"consumes_axes":[],"dtype":"integer","path":["x"]},{"accessor_name":"at_y","axes":[],"consumes_axes":[],"dtype":"integer","path":["y"]}],"modname":"schema_module","version":"0.1"},"version":"0.1"}}