{"bindings":{},"capabilities":{"layout":"nested_array"},"hashes":{"bindings":"44136fa355b3678a1146ad16f7e8649e94fb4fc21fe77e8310c060f61caaff8a","inputs":"4f53cda18c2baa0c0354bb5f9a3ecbe5ed12ab4d8e11ba873c2f11161202b945","ops_by_decl":"7f66664ce87e197022a270c63f4b2bd64b09782f1bffc2ed948bab6508c18d48","plan":"4636cecab79a406a819a358548690a15cef278e63638e46c267146e66500ccd3"},"inputs":[],"module_id":"schema_module","ops_by_decl":{"order_item_flags":{"operations":[{"args":[["orders","items","qty"]],"attrs":{},"id":0,"op":"LoadInput"},{"args":[0],"attrs":{},"id":1,"op":"Const"},{"args":[0,1],"attrs":{"fn":"core.gt"},"id":2,"op":"Map"}],"result":2},"per_order_qty_sum":{"operations":[{"args":[["orders","items","qty"]],"attrs":{},"id":0,"op":"LoadInput"},{"args":[0],"attrs":{"axis":"items","fn":"agg.sum"},"id":1,"op":"Reduce"}],"result":1}},"pack_version":"0.1","plan":{"declarations":{"order_item_flags":{"axes":["orders","items"],"axis_carriers":[{"axis":"orders","via_path":["orders"]},{"axis":"items","via_path":["orders","items"]}],"inlining_decisions":{},"name":"order_item_flags","parameters":[{"kind":"input","path":["orders","items","qty"]}],"reduce_plans":[],"result_id":2,"site_schedule":{"by_depth":[{"depth":0,"ops":[{"id":1,"kind":"const"}]},{"depth":1,"ops":[]},{"depth":2,"ops":[{"id":0,"kind":"loadinput"},{"id":2,"kind":"map"}]}],"hoisted_scalars":[{"id":1,"kind":"const"}],"max_depth":2,"root_reduces":[]}},"per_order_qty_sum":{"axes":["orders"],"axis_carriers":[{"axis":"orders","via_path":["orders"]}],"inlining_decisions":{},"name":"per_order_qty_sum","parameters":[{"kind":"input","path":["orders","items","qty"]}],"reduce_plans":[{"arg_id":0,"axis":"items","op_id":0,"reducer_fn":"agg.sum","result_depth":1,"via_path":["orders","items"]}],"result_id":1,"site_schedule":{"by_depth":[{"depth":0,"ops":[]},{"depth":1,"ops":[{"id":1,"kind":"reduce"}]},{"depth":2,"ops":[{"id":0,"kind":"loadinput"}]}],"hoisted_scalars":[],"max_depth":2,"root_reduces":[]}}},"module_spec":{"declarations":["per_order_qty_sum","order_item_flags"],"inputs":[{"accessor_name":"at_orders","axes":["orders"],"consumes_axes":["orders"],"dtype":"array","path":["orders"]},{"accessor_name":"at_orders_items","axes":["orders","items"],"consumes_axes":["orders","items"],"dtype":"array","path":["orders","items"]},{"accessor_name":"at_orders_items_qty","axes":["orders","items"],"consumes_axes":["orders","items"],"dtype":"integer","path":["orders","items","qty"]},{"accessor_name":"at_inventory","axes":["inventory"],"consumes_axes":["inventory"],"dtype":"array","path":["inventory"]},{"accessor_name":"at_inventory_items","axes":["inventory","items"],"consumes_axes":["inventory","items"],"dtype":"array","path":["inventory","items"]},{"accessor_name":"at_inventory_items_sku","axes":["inventory","items"],"consumes_axes":["inventory","items"],"dtype":"integer","path":["inventory","items","sku"]}],"modname":"schema_module","version":"0.1"},"version":"0.1"}}