{"bindings":{},"capabilities":{"layout":"nested_array"},"hashes":{"bindings":"44136fa355b3678a1146ad16f7e8649e94fb4fc21fe77e8310c060f61caaff8a","inputs":"4f53cda18c2baa0c0354bb5f9a3ecbe5ed12ab4d8e11ba873c2f11161202b945","ops_by_decl":"334e01705cd58101ec9330c2bd1364b758343f5093783fad95a91a26d7fa1eb6","plan":"1b6cb9f03b67373a31aaec2e766e6f0360292b58f137674466f45f08e85353e0"},"inputs":[],"module_id":"schema_module","ops_by_decl":{"double":{"operations":[{"args":[["x","y","z"]],"attrs":{},"id":0,"op":"LoadInput"},{"args":[2],"attrs":{},"id":1,"op":"Const"},{"args":[0,1],"attrs":{"fn":"core.mul"},"id":2,"op":"Map"}],"result":2}},"pack_version":"0.1","plan":{"declarations":{"double":{"axes":[],"axis_carriers":[],"inlining_decisions":{},"name":"double","parameters":[{"kind":"input","path":["x","y","z"]}],"reduce_plans":[],"result_id":2,"site_schedule":{"by_depth":[{"depth":0,"ops":[{"id":0,"kind":"loadinput"},{"id":1,"kind":"const"},{"id":2,"kind":"map"}]}],"hoisted_scalars":[{"id":0,"kind":"loadinput"},{"id":1,"kind":"const"},{"id":2,"kind":"map"}],"max_depth":0,"root_reduces":[]}}},"module_spec":{"declarations":["double"],"inputs":[{"accessor_name":"at_x","axes":[],"consumes_axes":[],"dtype":"hash","path":["x"]},{"accessor_name":"at_x_y","axes":[],"consumes_axes":[],"dtype":"hash","path":["x","y"]},{"accessor_name":"at_x_y_z","axes":[],"consumes_axes":[],"dtype":"integer","path":["x","y","z"]}],"modname":"schema_module","version":"0.1"},"version":"0.1"}}